{
  "schema": "cool.receipt.v1",
  "record": {
    "schema": "cool.inference.v1",
    "record_id": "01J6XR7K8M2Q3N5P7R9TVWXYZ0",
    "time": {
      "issued_at": "2026-06-22T10:14:07.221Z",
      "seq": 1048576
    },
    "model": {
      "id": "acme/credit-scorer",
      "version": "2026.06.0",
      "weights_hash": "mh:sha256:b2f303c4e54fca3509f5f4899f9cbff6fb897b36dbf046d826b19d07009b05c5",
      "provider": "mock-local"
    },
    "request": {
      "input_hash": "mh:sha256:8fcad1ab132b5269ba88b8da6a66228693fa52e59c9bde817fe3c9ac860d9405",
      "input_salt": "hex:8225b81e775a20525c78ca327f2711ed",
      "params_hash": "mh:sha256:759fc233156a41dcb5f273579d645c5982780c67890dc5aabd3eb84ba032ac7d"
    },
    "response": {
      "output_hash": "mh:sha256:958ba67718bd5fcb4ac71496bb268a6650db7419d91d36f9c552d11d4ee9c9e7",
      "output_salt": "hex:3150cb2dbecca942310e7999c1bc7a6a"
    },
    "runtime": {
      "tee_vendor": "none",
      "mode": "mock",
      "enclave_measurement": null,
      "tee_quote": null
    },
    "signature": {
      "alg": "ml-dsa-65+ed25519",
      "key_id": "cool-sign-2026Q2-01",
      "ml_dsa": "base64:5fF3iNOX27SUlG/H/YYWkPX+0HfWQuaP4dm3SUY8bg9/IoJ5L3f1a58y+gVaSUcwL9NVmlCc2Z3JLb6POs2zbsN2P9Y/uYS/auxcda7bjAna0UnbAylc8cvtLRy9D8p2uSuW2Agry4YBUvnYEn8Et43RELmnTVrIeQDm2zyKx+9YljVxH9uxurLQeVWxeS0DfSsHkw0agbFvNMcGzhGw1m91D7rV499ki92mTvat4rupdehc5Iv7o4QaAURYAgmVsA1RoUmec02mC3NaAlYaaHoLHJ3bfA4PffSXEPF5inbV8xD40BeAI4eBAOsW9yTlmaQ40ntz6F54BTojuXqzyDzR4ZjteGqQ5VgfUEWSTSywlIe5OPguA8Ml0E80JSjvGtxC/Kltewil47JGP8v82ripbesMHnwu6yXPfxXWLOnHn8BKKVgcHm46xGEz5D8hG/V+Hh47m+kb4aNKtM0xNcLP/FY0npTiEgbFEk5nkbvABWwb+KVi7o4FTyxvhYqSL7KR36Rk6ZfU2+VMkq1+Gza/pjruJkVlZAgUR983EZ5sYAqRZmtbTmT4hl8G42FIIwBPxWmRaD724wdIVnIHhtZ/oZpIEC/a+UgNKZTNxfdJfAZ32BZCHqtiiovS45PxRx1avl1MQtD0c4xJTGCmZ+re7+tlbG5D1Km17G0TzJiXS/wkdmSsLKsaIyAdoOjnvhqyD/OeC05LiKC+0N3k+HNLhuQDfY97cjtaJl419Dyw4gjeQFFPxs4lZJUWwmCy7jG6xLHM/kR9UjVFG7huuCazu9PpBewDaQYQkA2xRATW4eQM/qnuYBvFn2Jkj3JHFOs3gCCS9juJU8KRZNTx8bkEGVSzB9urF+cdz0WLpyl890JDVgE3zN3nCB5k+eKTCz1HruCfmYlV5n0qSZQwPkLwR8UL+k7/X1+EB6wMOpRsSorP0/izKV356Hg4BoMP7MVBbDr7UCHgoSNN7g1LpfJGiTcqD00cOyojALhykYEKm4BH04ouxMvfiSaRYgmHTDXrcADqccfimRxxxfuCsIUy+PYgIJS8HFc4gD1p9lzf9NWmJzgPyuU+nNOb0UJr9Tzq+mkDkgKoA3+XJ5R/kSPRfm9R9MQuDOi/xV1EapOkM3za9v5Ww1YgxpzVCK6YtOELQWAqh+CB3cax6FD7pdZDFgtAla53AWG2Tg7TqzWLK3ZGmwWO8Xx1LtL0h+5ltbXNIHsXFHYzx+vejKlbpex0f5WD5PsQcb9pt88zx3jgEz9/FdvtxRSWTEwGN7iXXxeQ93iYPRJfZjqYXqIExebl6xObS6MyG6o6pJKk8nwoZ04aBlivbKH1ACmy4Ef9x8vZw0sx7/dAmXyN6yMnPwz4qnh5qfoOxd+jTJANEQJe03aXcs/6YJHFRVNNQFVWcHht92UWmdrlUqZXcxDJdEdUYk2Xm6jM4YOa6b6+KV5CQi7aVVOUbC3Sj63/fcHPSoV7y3Vab/lIN+6dqvBpn0ipZZwCsSZXRV/Y2miSMYJf8Evn+eQqK16amkezZr20jNL1wEMZoibTIwQ49JMjrK5LTJsGuju0VhLtZbp4ucDEJOncxODsiQG/S0WY5D5UJqsVVGYM0ERcDnHZR7IZpNTn3flwsFVAfjObh+gQwsgMa01fH2G51+6RrYN1/f9x0UwLztQm5kqo3k/mlx5HjyJwyJtmwl75fWQaFFzxOqSK0eurSyW8paI/kun5TPOjcNiawUFaMfep0JBmQbooZ24nZIsa9qP2Snfa3WiwIa8PS55IALhow6vYYNsOFPC6nwVKDEnpnPE4ncGyxIZpMIchTA+dL1LcGDmCnkByZvCoIdr5WBVCfSGG6ghlibAeyQIAP46rWe3rQ8pr/rXbu6pV/NcDRVOoWEJFQIUwAq/vlRfpVPfVgaQEimE6z7Ie4cyWbldKj5hajv8QTccNNXPkhV+OUpLTrsKqrCJnqqdbzAklBx7Ysp/Wd0G2f6UNThDLmR9cv0GbYaQ4tmJlpq8Bcm0YOsYV5eZJWLMP8DzSR8fiPySkQyp3ZgJ1o6bewTL/vn5KJRKfacZoBjvtE7MG4VkV/narLC+D5n0lPAhnHTtF7nyJ8rCX8w6I7oWfPXKwdXrfNDfB8uVpO+cYOoEfZP29Wrus205vI1amIbEBdpUbpiFxAyxCzxIDHtTMnDvKilMpdVXvaNAsc3sTSmz5JVH74oaeNNIUI75mPqPMeF6GeJeL5OdCaiVVjLFFJQWD1tP897zfsCuYb1D5FGIuUb89KdHrot6lPXZ+BxBSrJLHDRXX0f6ry0m6LakFK2aICQFVkURlBOJ/uWCJfvbqLIZ/vnvgSmYMFfLz5A1H7Qjz1Wk9imqeOWylS1yFqh+4AePYIee5XUA8/jKu48c/kcJhGcZWv9pPPxl26xbp/Zb+lV6z9sY35rqUcDoDT+W2Id+JsaOe7S1dsI7YBciAWtXGc07jn/RYu65IivoLM3KVuhP6wGbkUUdrhhOMEoBZ80C8JN7cZU/Nv1I0DYlW2GoRD1UnW6ou/zijwyNSRc7kAJaQ2YR2xEglw8V5ZDcwAFJR8GMfw3dv4+nmKBQ115jYl7H7dsyXWFrGgigUYxG5mK+eU8TvlupV+FlZF/YEpL4w4xfA6hPalk6/ND9UH3h5x/ehNSTxDXHeg5smiyQybH1evOuVxIL5KflVPsBMEpGuxDZPMVdLtVPZXlFzWP4VT6lhf8dgDZ3jsxI24PQF3uhvp3z10d+biRCu2HwrnARdcD0aYhCEv6w8EHB0xA65ygDs5YRyNMGItoBFEHPOM4QDsXR25zYBR4H45/Ih4tGFQgfyu6Z1NjVT+zAoOBwBfEBSY+R603CZJW1kd25gFZcF0fv8N47MQRNBJDoR+1Q78rDlJyUi2zvVHQRrlUIqCsceBEEc5HmsMgcfnUyzcKH2vyWx64ce/aZLKKOtm6Ipl+QKpcYuiPBwXMEjzKwJEtGA31FucGoF1FNxICdWqEtPtuphJR5H6I/8mLiByqakZr9f4ox2WLnAZkXXGhUcRlDTUjJF7K1aEMTBBwKtHWS9NBp7lrCDc4X1yN3I33/0KcxeY3RKT+tDqyR5SHacBWjJ7QW4IwinLBizbUNc0KuwB1fHL8C8h0uRq3+RgFt5tx8ImaOJCBkD1E1ch200Dt+A2PPiAAYfA0+0cPOgJHikOD1kaVMtSGNqJcExF1cnv2XtR5iPgQt6d3woZjNuV/EexlxWIhG6QiUFrXs2FL4fJcrSqn+m3PcJyGumV0+75BK5hS00iJaDvVvj5XMXkC4Kj3MF6AzaWek66aKl624B58PG05I6ovtCp2Y1HTi/xTrzB9xGRPMp7xYfHbXerN/HcHKYMz39wD4nbc1zCUzR31EDc8+IHMbozwjW4ktqTTdRaCySPppnpRlGHq2F32UUG/exuBMWwNPoMeorCEl4EyaRG8d6horcGq0Dnro3/g01Y9OwXbtPj0ZUgdfudctOAnzk3umik7nPcbaB11vAAiG9lyj1+VNNqhzCqyvsE+bTz6MLxdWSmu85Y/DqPnaMY4vGiit0eJ/zElIt2lAgrAVuO5XO+kDzvSVpDDR+qOEQzCw8b7Oo5vENqoUaRA99r1DpcDi66oYDvwjyGA5ckDM6J1v91fRvHQzndZWp39ata+XAxS6FPeqzegMR1dKKV21rpzBiKCmea4Byd8MKnOto8DhPHZNchsFMrnrySjILhwv99lPyelMjpp5CEk/A2C1ul5Dfqx+wmoN9roXmU9NCeRwsKyHEL8llSw3JhMNvZTFb2BveV/94JxH+jxX97IpOgWhdNG6sxF9z4qD8Aj8rCqeWV3i75rQlyOcZVw6DodVH4kg8YwrzQ/sRQYXZ5tw8/LetJP/+PTUb5QNP5DG+C5cdU+gdYEiEqhTCBqKOcsvWpf++/orI8C/ZMwvCj6hG5km1q5XwYmd3VPl2if6e+N75Aof4Uyy1MwHm1z1T3yUN59rceUWek6DcQ1aWg2qiaLgLMcSV0wfwBTrCG8LwOBiYGTah4e1PE4gxJUNjcZkksajVO8ubqZTfV98FcRxbOGAbedN/anrXM5azmm8w7sHsKi+JcygjHIpLL/UZDbfiVZdUviPoQRmj8wDb7gUsYKiSjQwgAamzYMfDUVvvGbnJLo8htJkyQmA/EQdZcDKKCkjy0uhYBdISW969Wk4VbxtK8500O4MP8OOKHX4W+kryNlAvu53E/GQ494oxk+TJfQZ4esgrmTeM0WzUBPR2FWuzvkxXJUDGUL1JCAjg9j91RZeejjfm+GK+uGlKtH00jXmmQX/yOHqIcnVCmn97QPyVgdAHCK29+x0kornpjZ7oRlO41fsgJDJXkuT/VVfZAAAAAAAAAAAAAAAAAAAAAAAAAAAAAAAAAAAABQoNEhkc",
      "ed25519": "base64:TrD4gR7uerd38XvMZrdRhYKIHVl3YmcM3pMQpN702SzsqzDeZaypQQ8welKoQhvqoscYvXMGv65SxRenneJBAg=="
    }
  },
  "binding_hash": "mh:sha256:6bf098a1d7e47aa7eb91466750ab287cfc7815486da41b85b406e99e096202be",
  "inclusion": null,
  "sth": null,
  "attestation": {
    "mode": "mock",
    "note": "no hardware quote in v0"
  },
  "anchor": null,
  "key_directory": {
    "cool-sign-2026Q2-01": {
      "ml_dsa_pub": "base64:N1hKbkJ5rs7hMO6okJBFNqz0VTJJkj1PDrpC3kBHLM4zSYRWEoCNDlBrBOT+F4Gxwqrg1hZmxVQB6Bx6l/qWgG/+G3IKQOM6EXabFBqgrzJ6fCujkNFBhd1VS71G+RnUPHWGQ4/ShPdJWuWE7pU4UupBH6zypuG5VhnzmdrFEXFJyEc9cA5pBWYbdteRjsCo2yTpHs1Sqy51d01VWtPiji6Ubc8PReYxKybTYndvXVUFSXjDskFIZTVFG4ia46bLJJojz/Kpm5we5AQw+0YopfKBi/lFE8DhEGGi+8n0sKdoVbOAp2WBJCdlfO8Sz/teHJLmKy8K0rQodukGabRWPqYJ/xQcvozpc4NTgS/idHpy5C622iPvo2K926uFKwh9/C2m9O4yB7EzfuFc6YlC8PFMF2FwVIIDs3htaLSb7R/xtwBP6Gs18laRkDEtWpblakQLHN9HSajXLbYPy7RTO/wI6e3QQUlQ6ydkwR1QVUia71ornEMqb3FwTZwtWkrcjHfPS7pQ8ALHwWm4ZUhMirKpYHWyp+mTWk5LwBiqfAcGZIj9MeUDcsETL0ZEDcUfLl8FYaKPXkypqLWyXEBf1ianuG5vTOXisLqtSoPr4ZfqngpZneoxrxlhrf/1wEzNxekX3WR7r109BnXYy4THT9QsOo6a9iK3OvYTWYEiAXiqSe1ve6fxXitGlwL624zb+C3EcuUF186aEIRwgV7GqOz1FI1/Es892+vekZ/e6/GDbLggOOWhZ6WHdP8t/k+AkdK2tp+GIJKN8RMS1FvZEluP71TYHGnEONVHsTBKOQYTtMWQY9+TBERVVV6SSENlj2lDQQNZF4z2a4hmKb5pel/frV3UOg5fIklZD2BjpDHD709cBvFybhRLBBqIIWVRWoJAHusc7OBQxcIRzdaZfSfkUmgaq1FLVjXDAA1/8virg/Ry+iR2vkRh9RvvKMSKEtzgTigBiIWvk4zOM+mvf6d7mXCO5xmP5ODvDSlIKNxR90piRp0YgJZzZ7Vs9HAxTep5Zquf5/s2Qk1WQiFOhdPh8YJQvoAWyRtV/W5txctV9ncl6lIFlFyPH4M+TegYWKKvu1d6rUHr90pFhtrNm/P4XJEX2RpDjPD/Dqf5TQrrlgqomVmmYe7miDw7/57rxt9Xzg1cjdEMVoxBSVaHaLN4K9BWEhRvhQ4tvn5n5dHx3xny5h81JEIqWHrh8FFejFTPOIyb0AWshwYAtUfmxY0rgYjalCT8JliD3w/2oUQAZ7Xp3X5946/2GaFwkbQElmYccNIYKi4YvWZdoAmFlKkYdMH+6HgT2wU/qhgyg6oc3zKwvWyJsDGBC8em5YrJvNYH0kWD6f+ZOKhbhm0wvuZxTmgAH1Myd1RDCUNmtS211SeRqq/0VpeoztEslC6qNdk+VoWtRWfF+wSrhSVNXwj8PUhIcL+P6GgtyxFiQXqJK59WSIWqniB7jz1E5I1L6DFruUNv8Msdz8PdzukU3QM1LZYwE7q4I1U2q2pyt4bmyhD0GDCuGJNgfjsPrH7c2VxMowAkKYIXc/fRoUaNmOtHfZDIxny5gm0Y17Gho9d4eOrP6YOpfr8Kq4hQcuG0yTfzhLrvRIictACftSfu1LfRp0wv42L5fmT1uBJtuM09z/U4s+WLZwaIWPlU9FfIy0iDHCFUN4+WTed3ttu0FU1SSSKBjtMwj/YH+p8DALRzXJAUcU0AdYMjr0seJYof2aUu5RF4Nr/KIWKw/jZl4lLFWk/dvMyMAFl1ijDW0i0HdPxX2JjTIb94dP9blJ7j5+axtnBKE1uqKZYC1jOujc7kKI/g1IsU1PC8LkV5pWv2ntfSGG0tpScw73UnQ8Us0ugB1MHgKZlOI6mCUJEfyLPUoMxqm0UidncZxzxpphiciGWno3wAVAvHTKHFvGyXj9qOyihYWLhE8llssZ2D6nfwZHNPZznt6wQlFmF3WVRHKcySVRFbtw/+4pdoJN3u/4tTl/yR8dda0dXl05srienW+84s41ZpYM2vmRB/WKZnX6X7j/RcFOxd111FieQwVRzDetdcA0IzCT9LCMnWKycfzJscS0jKxbg9NNXkCjepTtXHmrDe32x9LLpRJrTU8QJQSBYPncOZGfgnkGQT6bDy6x96q+Kzj4y2PlFmC98bN0prd6Sh1vEoAdw3+81Q1ShstuvLtzIsgZdXkXJFR1qpMKl+UIn3j1zt71hshmyIb6f+67U0SaeOR4mkwX2Ti4qYDTu4wQIelqjyjDn/1zlhvIFntfxl90bXK4A367SPBQywF8WSan7KPHOTWreWG145mLLg4hjam42zdvq/Zm92g7m/0lD8qn89zjWHqhD/qmQepwN4NCVqyJdwL7ZdWJ1m6LnvU7nzd3kaQJsj9t+pJe3bG53iscylb5858MMIcAcx3Z1lFTPSwH3uHAljetZGz6BIFbJQUhVq8qEwyegisS2T8AE2mu5Ef4HLEgst9aOvZPvVuLlC1XWP5Ehv3bLqge2bcUG7+aVGyHzklMU3vDMOBeNk4mY9nWS/ktowFqJvaECFI3bhmXWcw9bMkDaSAKGIBftr+0Mzb+ZNNwyIN7DLTVPsA8bPN2JX1MQ=",
      "ed25519_pub": "base64:P78saRMJV4wDNpRakfhEADHdSwYts4QNpCb1NqbP6Q0="
    }
  }
}
